Nordic Nosedive:  Skiing Fails,,https://www.youtube.com/watch?v=Cb2GyIgnSNM,644 тыс. ,23_09_2022,1 год назад
We Have Lift Off: Fails of the Week (January 2021),FailArmy,https://www.youtube.com/watch?v=QRMA-LapZkw,"3,6 млн ",23_09_2022,1 год назад
Stupidity At Its Best,FailArmy,https://www.youtube.com/watch?v=Zcnh5cU25vU,"9,1 млн ",23_09_2022,1 год назад
Bear With Me: Fails of the Week (January 2021),,https://www.youtube.com/watch?v=Ewu7jxcOVkE,"2,2 млн ",23_09_2022,1 год назад
54 TERRIBLE DANCERS,,https://www.youtube.com/watch?v=wO7TSbN2-RM,504 тыс. ,23_09_2022,1 год назад
Strangest Moments of the Year (2020),FailArmy,https://www.youtube.com/watch?v=hcCnzIc7I_8,932 тыс. ,23_09_2022,1 год назад
Top 100 Fails of the Year (2020),FailArmy,https://www.youtube.com/watch?v=253DiiFjVak,31 млн ,23_09_2022,1 год назад
Best Fails I Had With My Friends (2020),FailArmy,https://www.youtube.com/watch?v=2-7sin5Bdt8,541 тыс. ,23_09_2022,1 год назад
Crash of the Titans,"You Break It, We Buy It",https://www.youtube.com/watch?v=DAbO1EMxAIk,94 тыс. ,23_09_2022,1 год назад
Top 100 Fails of the Year Part 5 (2020),FailArmy,https://www.youtube.com/watch?v=ZVn9om-CuG8,673 тыс. ,23_09_2022,1 год назад
The Ultimate Christmas Fail Compilation - The 8 Fails of Failmas,,https://www.youtube.com/watch?v=bs4F_VJwmS0,"4,9 млн ",23_09_2022,1 год назад
It’s The Most Wonderful Time of the Year,,https://www.youtube.com/watch?v=EoIltWzL6AM,855 тыс. ,23_09_2022,1 год назад
Top 100 Fails of the Year Part 4 (2020),FailArmy,https://www.youtube.com/watch?v=p59yIK9utRo,877 тыс. ,23_09_2022,1 год назад
Best Animal Fails of 2020,FailArmy,https://www.youtube.com/watch?v=s6g5qS52Gtw,866 тыс. ,23_09_2022,1 год назад
Broken Golf Club Redemption,"You Break It, We Buy It",https://www.youtube.com/watch?v=IAmNwEA5_P4,67 тыс. ,23_09_2022,1 год назад
Top 100 Fails of the Year Part 3 (2020),FailArmy,https://www.youtube.com/watch?v=WgGNqdT_3WU,784 тыс. ,23_09_2022,1 год назад
🔥 Virtual Yule Log - Dumpster Fire 2020 - FailArmy Classic Christmas Soundtrack 🔥,,https://www.youtube.com/watch?v=95tKy4R7wHA,116 тыс. ,23_09_2022,1 год назад
Funny Feminine Fails,FailArmy,https://www.youtube.com/watch?v=Jn9aOotpCIU,3 млн ,23_09_2022,1 год назад
Clash of the Clubs,"You Break It, We Buy It",https://www.youtube.com/watch?v=UVOmZrIwKqo,55 тыс. ,23_09_2022,1 год назад
Top Fails of 2020 Part 2,FailArmy,https://www.youtube.com/watch?v=DCp8LxrIxOo,"1,2 млн ",23_09_2022,1 год назад
Best Pranks of the Year (2020),FailArmy,https://www.youtube.com/watch?v=9FMtl_c7SL4,"6,1 млн ",23_09_2022,1 год назад
We Bought This Dude A ????,"You Break It, We Buy It",https://www.youtube.com/watch?v=7jk-RTFS8h8,89 тыс. ,23_09_2022,1 год назад
Top Fails of 2020 Part 1,FailArmy,https://www.youtube.com/watch?v=GCchK_G_POo,"1,4 млн ",23_09_2022,1 год назад
50 People Who Are Having A Bad Day,FailArmy,https://www.youtube.com/watch?v=2rGGlKePdgw,"4,8 млн ",23_09_2022,1 год назад
The Broken Bed,"You Break It, We Buy It",https://www.youtube.com/watch?v=Xro-s2zmK04,74 тыс. ,23_09_2022,1 год назад
Destroyed Televisions,"You Break It, We Buy It",https://www.youtube.com/watch?v=-avc_AADeac,161 тыс. ,23_09_2022,1 год назад
"Look Out, Man! Fails of the Week (December 2020)",,https://www.youtube.com/watch?v=Xc8k68DVpl8,"1,4 млн ",23_09_2022,1 год назад
Bon Voyage: Ridiculous Transportation Fails and Mishaps,FailArmy,https://www.youtube.com/watch?v=9o8g-b2jUDo,"1,7 млн ",23_09_2022,1 год назад
Destroyed Televisions,"You Break It, We Buy It",https://www.youtube.com/watch?v=kHyyA2NxpSo,119 тыс. ,23_09_2022,1 год назад
"I'm Sorry, Mom: Fails of the Week (November 2020)",,https://www.youtube.com/watch?v=pT9XNqLZln0,"1,1 млн ",23_09_2022,1 год назад
Gobble Gobble: Turkey Day is Coming,FailArmy,https://www.youtube.com/watch?v=Xum02ZQ6wk4,438 тыс. ,23_09_2022,1 год назад
Skateboard Fail Redemption,"You Break It, We Buy It",https://www.youtube.com/watch?v=6L3Q_2ZkXk4,109 тыс. ,23_09_2022,1 год назад
"Big Wave, Bigger Trouble: Fails of the Week (November 2020)",FailArmy,https://www.youtube.com/watch?v=glYETnxdoMA,"1,2 млн ",23_09_2022,1 год назад
She Wasn't Expecting THAT! Best Pranks of The Week,FailArmy,https://www.youtube.com/watch?v=sPx1ZASUV1U,"2,5 млн ",23_09_2022,1 год назад
Skateboard Fail Redemption,"You Break It, We Buy It",https://www.youtube.com/watch?v=_XT7_q8jNE4,136 тыс. ,23_09_2022,1 год назад
Wall to Wall Fails: Fails of the Week (November 2020),,https://www.youtube.com/watch?v=AG5qWNv0yCA,"1,8 млн ",23_09_2022,1 год назад
40 Ridiculous Beauty and Hair Fails,FailArmy,https://www.youtube.com/watch?v=A2cYMSXlanE,1 млн ,23_09_2022,1 год назад
Boo! Spooky Zombie! Fails of the Week (November 2020),,https://www.youtube.com/watch?v=4ocQSj9JPM8,"1,8 млн ",23_09_2022,1 год назад
Epic Drone Fails - Top 40 Drone Fails of All Time,FailArmy,https://www.youtube.com/watch?v=s3iML1HgVGI,"1,5 млн ",23_09_2022,1 год назад
Achoo! Fails of the Week (October 2020),,https://www.youtube.com/watch?v=maqUxRXQ-4I,"1,6 млн ",23_09_2022,1 год назад
Bad Hair Day: Fails of the Week (October 2020),FailArmy,https://www.youtube.com/watch?v=s9Nb1k1_-9o,"1,2 млн ",23_09_2022,1 год назад
Look at My Package: Delivery Fails,FailArmy,https://www.youtube.com/watch?v=uf3Mo0U8Y9s,"1,4 млн ",23_09_2022,1 год назад
Lost in Translation: Fails of the Week (October 2020),FailArmy,https://www.youtube.com/watch?v=O6YvUy08MVk,"1,1 млн ",23_09_2022,1 год назад
Remote Controlled Chaos (October 2020),FailArmy,https://www.youtube.com/watch?v=-3subY9VcNk,2 млн ,23_09_2022,1 год назад
Taco Time: Fails of the Week (October 2020),FailArmy,https://www.youtube.com/watch?v=VCjygJJzUUk,3 млн ,23_09_2022,1 год назад
Lord of Destruction: Break Everything,FailArmy,https://www.youtube.com/watch?v=pogxUEj04sc,"2,4 млн ",23_09_2022,2 года назад
Zany Zombie: Fails of the Week (September 2020),FailArmy,https://www.youtube.com/watch?v=hAn43wBfKq8,"1,4 млн ",23_09_2022,2 года назад
You're Grounded,FailArmy,https://www.youtube.com/watch?v=3oycBiqs6Rw,"5,3 млн ",23_09_2022,2 года назад
Relationship Goals: Forever Alone,,https://www.youtube.com/watch?v=kWgRQ6fi-2I,"1,7 млн ",23_09_2022,2 года назад
Horsing Around: Fails of the Week (August 2020),,https://www.youtube.com/watch?v=2qyDhOblmwY,"1,2 млн ",23_09_2022,2 года назад
I Regret Everything (August 2020),FailArmy,https://www.youtube.com/watch?v=3_dTjmqcXhE,"3,2 млн ",23_09_2022,2 года назад
Q-Tip Chaos: Fails of the Week (August 2020),FailArmy,https://www.youtube.com/watch?v=tx2evxicsRM,"1,1 млн ",23_09_2022,2 года назад
School Days: Already Failing (August 2020),,https://www.youtube.com/watch?v=xghurUzzZGU,870 тыс. ,23_09_2022,2 года назад
Bird is the Word: Fails of the Week (August 2020),FailArmy,https://www.youtube.com/watch?v=uQbLslfpKxw,"1,2 млн ",23_09_2022,2 года назад
The Blind Leading the Blind (August 2020),FailArmy,https://www.youtube.com/watch?v=1heax6FBhiA,819 тыс. ,23_09_2022,2 года назад
"Please Help Me, I'm Falling: Fails of the Week (August 2020)",,https://www.youtube.com/watch?v=hUvV401elPc,4 млн ,23_09_2022,2 года назад
Welp: That Didn't End Well,,https://www.youtube.com/watch?v=wcURBiEy4rk,"1,5 млн ",23_09_2022,2 года назад
Best Fails of the Year (So Far) 2020,FailArmy,https://www.youtube.com/watch?v=D46jk5Tp38c,10 млн ,23_09_2022,2 года назад
I Hate Chores (July 2020),FailArmy,https://www.youtube.com/watch?v=jdEM_Xt2JZs,710 тыс. ,23_09_2022,2 года назад
I'm So Tired of Struggling (July 2020),FailArmy,https://www.youtube.com/watch?v=1fpa4sgRUFc,"1,6 млн ",23_09_2022,2 года назад
How I Cracked My Cellphone Screen (July 2020),FailArmy,https://www.youtube.com/watch?v=rvNLo4oQYIw,641 тыс. ,23_09_2022,2 года назад
18 Hilarious Moments Caught On Security Cameras,FailArmy,https://www.youtube.com/watch?v=_gOie53gIoI,830 тыс. ,23_09_2022,2 года назад
Bad Day at Work - Best Funny Work Fails 2020,,https://www.youtube.com/watch?v=KNexq5DXScA,782 тыс. ,23_09_2022,2 года назад
Woman Shock With Airplane Passengers Foot Next to Her,Fails of The Week 2020,https://www.youtube.com/watch?v=gZt5yJnXFCE,"1,3 млн ",23_09_2022,2 года назад
29 Fail Videos That Prove The Existence Of Gravity 2020,FailArmy,https://www.youtube.com/watch?v=0aZoHLTGU5Q,"1,1 млн ",23_09_2022,2 года назад
TRY NOT TO LAUGH - Best BACK TO SCHOOL Fails Compilation 2020,FailArmy,https://www.youtube.com/watch?v=uB2v7zoM4Ig,"1,7 млн ",23_09_2022,2 года назад
Funniest Fails Compilation : Try Not To Laugh 2020,FailArmy,https://www.youtube.com/watch?v=56HIsX7rZqo,"1,6 млн ",23_09_2022,2 года назад
Hilarious Dogs 🐶 - Awesome Funny Pet Animals Videos,FailArmy,https://www.youtube.com/watch?v=ybjO1UlKlWc,997 тыс. ,23_09_2022,2 года назад
Hilarious Double Fails Compilation 2020,Funny FailArmy,https://www.youtube.com/watch?v=EtVpMdUu1xI,"1,3 млн ",23_09_2022,2 года назад
8 Reasons Why Being New In Town is Tough,,https://www.youtube.com/watch?v=2DHEbCDibaM,622 тыс. ,23_09_2022,2 года назад
Adjust Your Attitude - People With Anger Issues,FailArmy 2020,https://www.youtube.com/watch?v=LpM9MFATzzw,"1,3 млн ",23_09_2022,2 года назад
Wave Takes Out Woman: Hilarious Fails,FailArmy,https://www.youtube.com/watch?v=ZGJbgim2oiM,"1,3 млн ",23_09_2022,2 года назад
Captain of Failure : Water Fails Compilation,FailArmy,https://www.youtube.com/watch?v=BzuOOeNZyXo,"2,6 млн ",23_09_2022,2 года назад
Cop/Criminal Fails: I Need a Lawyer,FailArmy,https://www.youtube.com/watch?v=_ItEEQLqvBA,1 млн ,23_09_2022,2 года назад
Body Builder Prank: Can't Reach His Back - Funny Videos,FailArmy,https://www.youtube.com/watch?v=eQtYYndJP8s,2 млн ,23_09_2022,2 года назад
TRY NOT TO LAUGH - Funny SCARE PRANKS! FailArmy,,https://www.youtube.com/watch?v=Z3m0HkRaiYk,"1,2 млн ",23_09_2022,2 года назад
Things to DO When You're Under Quarantine (March 2020),FailArmy,https://www.youtube.com/watch?v=Ff6PU7EhweU,"3,6 млн ",23_09_2022,2 года назад
Epic Boat Fails 2020: Funniest Water Videos,FailArmy,https://www.youtube.com/watch?v=ArkJiu5PCbY,"7,9 млн ",23_09_2022,2 года назад
Man Loses Shoes Slipping On Icy Driveway,FailArmy,https://www.youtube.com/watch?v=B_49Y7NiP_8,"2,5 млн ",23_09_2022,2 года назад
Sporting Fails! Ready for the Super Bowl!,FailArmy,https://www.youtube.com/watch?v=QYAcnH4vKe0,910 тыс. ,23_09_2022,2 года назад
"Pets, Interrupted (January 2020)",FailArmy,https://www.youtube.com/watch?v=uLZfdZmHTsg,"5,6 млн ",23_09_2022,2 года назад
Busted: Bad Boys (January 2020),FailArmy,https://www.youtube.com/watch?v=wXr1oq-pxwo,"3,2 млн ",23_09_2022,2 года назад
New Year Fails 2020,FailArmy,https://www.youtube.com/watch?v=IrDbkeIPHug,"1,3 млн ",23_09_2022,2 года назад
Top 100 Fails of the Year Part 3 (2019),FailArmy,https://www.youtube.com/watch?v=Up2VfbUVMfU,"2,2 млн ",23_09_2022,2 года назад
Man Can't Find Phone On His Back: Top Fails of the Year,FailArmy,https://www.youtube.com/watch?v=VsqAaZiAB_E,"2,3 млн ",23_09_2022,2 года назад
Fashion Fails: Coke in Carbonator?! What Could Go Wrong?!,FailArmy,https://www.youtube.com/watch?v=8pmZyK0rNkc,"1,1 млн ",23_09_2022,2 года назад
Break Fails: Fails Of The Week Compilation,FailArmy,https://www.youtube.com/watch?v=I9AjBZZUdPc,"1,2 млн ",23_09_2022,2 года назад
What's For Lunch? Food Fails (November 2019),FailArmy,https://www.youtube.com/watch?v=Lx7dZrKzPTA,"1,1 млн ",23_09_2022,2 года назад
Try Not To Laugh Watching Funny Animal Fails Compilation 2020,,https://www.youtube.com/watch?v=YsbsLw8Qgn4,3 млн ,23_09_2022,2 года назад
The Best Work Fails: Bad Day at Work 2020,FailArmy,https://www.youtube.com/watch?v=QaJg8gdpM_0,"6,1 млн ",23_09_2022,2 года назад
Public Freakout Compilation 2020,FailArmy,https://www.youtube.com/watch?v=wPoeLo5TuyI,4 млн ,23_09_2022,2 года назад
32 Fails Guaranteed To Make You Laugh,FailArmy,https://www.youtube.com/watch?v=lnXeybyTycg,3 млн ,23_09_2022,2 года назад
21 Internet Classic Viral Videos Compilation,FailArmy,https://www.youtube.com/watch?v=mpaBTcNiI3A,"4,7 млн ",23_09_2022,3 года назад
TRY NOT TO LAUGH - EPIC FAILS,Funny Videos FailArmy,https://www.youtube.com/watch?v=9MBshxwBfis,"1,9 млн ",23_09_2022,3 года назад
Funny Farm Tractor Fails Compilation,FailArmy,https://www.youtube.com/watch?v=dG3Vp8yTIPI,"1,3 млн ",23_09_2022,3 года назад
Sea Lion Steals Man's Fish: Fails Compilation,FailArmy,https://www.youtube.com/watch?v=OvSowXSHLuY,"1,7 млн ",23_09_2022,3 года назад
Fails Guaranteed To Make You Laugh 2020: Funny Fails Compilation,FailArmy,https://www.youtube.com/watch?v=LIS00fluB5o,"8,3 млн ",23_09_2022,3 года назад
37 Moments In Sports They Try to Forget: Instant Regret,FailArmy,https://www.youtube.com/watch?v=Ci9DRUTDcis,"4,1 млн ",23_09_2022,3 года назад
Best Fails of the Year (So Far),FailArmy,https://www.youtube.com/watch?v=wZ_9KTAg1Yo,16 млн ,23_09_2022,3 года назад
The Dumbest American Fails from all 50 States,FailArmy,https://www.youtube.com/watch?v=0P6e2YOQkJw,"6,2 млн ",23_09_2022,3 года назад
TRY NOT TO LAUGH - Epic SUMMER FAILS Compilation,FailArmy,https://www.youtube.com/watch?v=LIhWCIPsC6s,"6,6 млн ",23_09_2022,3 года назад
Scooter Stupidity: Funny Fails of the Week,FailArmy,https://www.youtube.com/watch?v=0KXA2PlDcKw,"5,1 млн ",23_09_2022,3 года назад
Eye Popping Fails 2020: Fails of the Week l FailArmy,,https://www.youtube.com/watch?v=XIKGwDF0nck,"1,7 млн ",23_09_2022,3 года назад
32 Activities BANNED in the House,Funny Fails Video FailArmy,https://www.youtube.com/watch?v=3pJdogD6N74,"1,5 млн ",23_09_2022,3 года назад
Off Balance: Fails of the Week (June 2019),FailArmy,https://www.youtube.com/watch?v=DHi4K5RzIbE,"2,2 млн ",23_09_2022,3 года назад
Planet Earth: FailArmy Fails Edition,FailArmy,https://www.youtube.com/watch?v=tszy3gZhUrU,"4,3 млн ",23_09_2022,3 года назад
That's Going to Leave a MARK!,,https://www.youtube.com/watch?v=J4uvkfl2oQ0,"1,5 млн ",23_09_2022,3 года назад
Bad Hair Day: Fails of the week (April 2019),FailArmy,https://www.youtube.com/watch?v=Tm85s7X77Vw,"2,5 млн ",23_09_2022,3 года назад
NOT THE SMARTEST DOGS - Derpy Dogs - LAUGH Compilation,,https://www.youtube.com/watch?v=JOVbv6wX-Kk,"8,1 млн ",23_09_2022,3 года назад
Best Water Fails,,https://www.youtube.com/watch?v=UT7j_1xXYoY,6 млн ,23_09_2022,3 года назад
OUCH! That Does NOT Belong There!,,https://www.youtube.com/watch?v=kN-6KiWl260,"3,1 млн ",23_09_2022,3 года назад
Fish Slaps Woman During A Storm,You wouldn't Believe it FailArmy,https://www.youtube.com/watch?v=SqY8efoKG5w,"1,1 млн ",23_09_2022,3 года назад
Expensive Technology Fails: This is Why I'm Broke,FailArmy,https://www.youtube.com/watch?v=ZYUQm9O33pM,"6,1 млн ",23_09_2022,3 года назад
Funny Mattress Fails And Wins Compilation,FailArmy,https://www.youtube.com/watch?v=ctqVcopSA_c,"5,7 млн ",23_09_2022,3 года назад
Ultimate Beach Fails,Funniest Beach Fail Compilation 2020,https://www.youtube.com/watch?v=U1bIBgeQkac,"6,8 млн ",23_09_2022,3 года назад
Party On: Lets Get Wild!,FailArmy,https://www.youtube.com/watch?v=2TAzv_vRqmo,"1,5 млн ",23_09_2022,3 года назад
PEOPLE VS GLASS! Broken Windows Shattered Glass,FailArmy,https://www.youtube.com/watch?v=4MjJFg7rA4g,"2,4 млн ",23_09_2022,3 года назад
Living on the Edge: Send It! (November 2018),FailArmy,https://www.youtube.com/watch?v=xss1UUuhsYM,2 млн ,23_09_2022,3 года назад
Cut it Out: Knife Fails (October 2018),FailArmy,https://www.youtube.com/watch?v=uQCwRducGB4,"1,3 млн ",23_09_2022,3 года назад
Amusement Park Fails: This Was Supposed to Be Fun!,FailArmy,https://www.youtube.com/watch?v=ymEkpfyD6Rs,"3,9 млн ",23_09_2022,4 года назад
Epic Cat Fails Compilation,Funny Try Not to Laugh! FailArmy,https://www.youtube.com/watch?v=oQohlprQiWc,"1,5 млн ",23_09_2022,4 года назад
Animals Can Be Jerks! Funny Video,FailArmy,https://www.youtube.com/watch?v=ZMel6h2jywk,10 млн ,23_09_2022,4 года назад
Funniest Dog Fail Compilation 2020,,https://www.youtube.com/watch?v=8E5VBD10qBw,"1,8 млн ",23_09_2022,4 года назад
Fails of The Week: Fan Submissions,FailArmy,https://www.youtube.com/watch?v=xOVe8GRrHnQ,948 тыс. ,23_09_2022,4 года назад
Fails You Missed: Did That Girl Fart?,FailArmy,https://www.youtube.com/watch?v=qwCdx0FgTRE,9 млн ,23_09_2022,4 года назад
Animals In Predicaments: Animal Fails,FailArmy,https://www.youtube.com/watch?v=iMDQT7KqIhM,"2,6 млн ",23_09_2022,4 года назад
He Didn't EXPECT THAT!,,https://www.youtube.com/watch?v=YCKI4FtezDk,"5,5 млн ",23_09_2022,4 года назад
Funny Fails Compilation: Try Not To Laugh!,FailArmy,https://www.youtube.com/watch?v=ot-zPATBzLQ,12 млн ,23_09_2022,4 года назад
"Expensive Fails: Mo Money, Mo Fails",FailArmy,https://www.youtube.com/watch?v=AaWn4VP37SU,16 млн ,23_09_2022,4 года назад
Fails You Missed: Didn't See That Coming,FailArmy,https://www.youtube.com/watch?v=IH6pbj6Ebec,"3,7 млн ",23_09_2022,4 года назад
Man Breaks Laptop Breakdancing: Fails of The Week,FailArmy,https://www.youtube.com/watch?v=ekwpkpLg3gQ,3 млн ,23_09_2022,4 года назад
Crazy Drivers: Close Calls Compilation,FailArmy,https://www.youtube.com/watch?v=hyING6J2i6Q,"9,8 млн ",23_09_2022,4 года назад
"Gym and Workout Fails: New Year, New Me",FailArmy,https://www.youtube.com/watch?v=2FOEfCcsqhw,4 млн ,23_09_2022,4 года назад
Try Not to Laugh Challenge! Funny Fails,,https://www.youtube.com/watch?v=bf2ASh5vS-s,119 млн ,23_09_2022,4 года назад
The Top 29 Dog Fails: Funny Dog Videos: FailArmy,,https://www.youtube.com/watch?v=-SY-aeSplco,"4,4 млн ",23_09_2022,4 года назад
I Am Stuck In This Car!: Fails You Missed #16,FailArmy,https://www.youtube.com/watch?v=SM8xMRZz8xk,"1,5 млн ",23_09_2022,4 года назад
Funny Fails: Instant Regret Videos,FailArmy,https://www.youtube.com/watch?v=hVTj_oKlvZA,2 млн ,23_09_2022,4 года назад
Top 25 Halloween Videos,,https://www.youtube.com/watch?v=tTkqbgaKjP0,"4,8 млн ",23_09_2022,4 года назад
Best Fail Reactions: Now That's Funny! (Sep 2017),FailArmy,https://www.youtube.com/watch?v=8QDITxYc02Y,"3,3 млн ",23_09_2022,5 лет назад
He Did WHAT?! Wins and Fails,FailArmy,https://www.youtube.com/watch?v=TzQfpxYXzBk,14 млн ,23_09_2022,5 лет назад
Back To School Fails : Hall of Fame,FailArmy,https://www.youtube.com/watch?v=aCPTid5qBQc,"3,9 млн ",23_09_2022,5 лет назад
Sticks vs. Stones: FailArmy Versus (Sep 2017),FailArmy,https://www.youtube.com/watch?v=J_ebXdZe-I4,"2,8 млн ",23_09_2022,5 лет назад
Funny Pet Fails: Funniest Pet Video Compilation,FailArmy,https://www.youtube.com/watch?v=hNdlUHBJDKs,"6,1 млн ",23_09_2022,5 лет назад
Cooking Food Fails,,https://www.youtube.com/watch?v=v0KfinYm9rI,"2,2 млн ",23_09_2022,5 лет назад
Workplace Fails: You're Fired!,FailArmy,https://www.youtube.com/watch?v=wdodSJvt1z0,"6,7 млн ",23_09_2022,5 лет назад
Expensive Fails: That's Going To Cost You!,FailArmy,https://www.youtube.com/watch?v=JB3MqIpNXhA,35 млн ,23_09_2022,5 лет назад
Hilarious Summer vs. Winter Fails,Funny Videos: FailArmy,https://www.youtube.com/watch?v=VSG2eaAgTuU,"7,5 млн ",23_09_2022,5 лет назад
26 Bad Friend Nominees: Hall Of Fame,FailArmy,https://www.youtube.com/watch?v=noOAMVL2PvM,"3,5 млн ",23_09_2022,5 лет назад
Hilarious Truck Fails: TRY NOT TO LAUGH,FailArmy,https://www.youtube.com/watch?v=h9YnQzWiHKc,12 млн ,23_09_2022,5 лет назад
What Could Go WRONG?!,Fails Of The Week - FailArmy,https://www.youtube.com/watch?v=7vHVnIKvON8,13 млн ,23_09_2022,5 лет назад
People Vs. Nature Fails: Taken Out By Wave,FailArmy,https://www.youtube.com/watch?v=OSgYQl6GZbU,35 млн ,23_09_2022,5 лет назад
Throwback Thursday: Are My Teeth OK? (May 2017),FailArmy,https://www.youtube.com/watch?v=mpFnH_LyBuQ,"3,2 млн ",23_09_2022,5 лет назад
34 Workout Fails You DON'T Want To Repeat! FailArmy,,https://www.youtube.com/watch?v=nk8agwWigww,32 млн ,23_09_2022,5 лет назад
Man Tries To Park Jeep On Wall and Fails,Fails Compilation,https://www.youtube.com/watch?v=1BIe29LC1Tg,"7,6 млн ",23_09_2022,5 лет назад
LIKE A BOSS COMPILATION: People Are Awesome! Wins vs. Fails,Failarmy,https://www.youtube.com/watch?v=gdJ2PftaaWQ,7 млн ,23_09_2022,5 лет назад
Winter Fails! Funny Winter Fails of The Week,FailArmy,https://www.youtube.com/watch?v=z1gtTVqmp3Q,25 млн ,23_09_2022,5 лет назад
Girl Fails Video: Hot Mess Express: Best of the Year,FailArmy,https://www.youtube.com/watch?v=ZkmMu_zAbt8,20 млн ,23_09_2022,5 лет назад
Like A Boss vs Fails Compilation: Wins vs. Fails,FailArmy,https://www.youtube.com/watch?v=l8Nx5JZoArU,17 млн ,23_09_2022,5 лет назад
What Were They Thinking? Fails Caught On Camera,FailArmy,https://www.youtube.com/watch?v=jkl-TeRI2bc,"8,6 млн ",23_09_2022,5 лет назад
Ultimate DRONE Fail Compilation!!! Drone Takedowns and Crashes 😂,FailArmy,https://www.youtube.com/watch?v=7Kfqbp9kn80,8 млн ,23_09_2022,5 лет назад
Best Wins VS Fails Compilation: People Are Awesome,FailArmy,https://www.youtube.com/watch?v=Pnv4jhYI8wg,18 млн ,23_09_2022,5 лет назад
Fail Olympics,,https://www.youtube.com/watch?v=ClRiAQmbAwc,"8,6 млн ",23_09_2022,6 лет назад
Fail Olympics,,https://www.youtube.com/watch?v=M7xfAiY-C1c,13 млн ,23_09_2022,6 лет назад
Best Fails of The Week: Funniest Fails Compilation: Funny Video,FailArmy,https://www.youtube.com/watch?v=94SKl5gmtQw,31 млн ,23_09_2022,6 лет назад
FailArmy Presents: People are Awesome,Epic Win Compilation,https://www.youtube.com/watch?v=r5R7wxskMFM,"6,1 млн ",23_09_2022,6 лет назад
*Try Not To Laugh Challenge* Funny Dogs Fail Compilation,FailArmy,https://www.youtube.com/watch?v=Eg86emJjbwk,11 млн ,23_09_2022,6 лет назад
Try Not to Laugh Challenge! Best Fails Of The Week,FailArmy,https://www.youtube.com/watch?v=ndFTtjiFQAk,18 млн ,23_09_2022,6 лет назад
Funny and Weird Weather,,https://www.youtube.com/watch?v=zoXM00Soj8U,52 млн ,23_09_2022,6 лет назад
