Funny Fall Fails,People Tripping and Falling Compilation,https://www.youtube.com/watch?v=b8Wor08C-Bc,1 млн ,23_09_2022,1 день назад
Gonna Need A Bigger Boat!,Fails of the Week,https://www.youtube.com/watch?v=4vIEJ6y9Lqw,"2,9 млн ",23_09_2022,6 дней назад
When Everything Goes Wrong,Fails Compilation,https://www.youtube.com/watch?v=MpHhFwKbRIQ,"5,9 млн ",23_09_2022,8 дней назад
Down They Go!,Fails of the Week,https://www.youtube.com/watch?v=531LA7J83Xw,"3,6 млн ",23_09_2022,13 дней назад
Total Idiots At Work,Funniest Office Fails,https://www.youtube.com/watch?v=V88Hc_taOYo,"2,6 млн ",23_09_2022,2 недели назад
Animals Gone Wild!,Fails Of The Week,https://www.youtube.com/watch?v=iyA8Tu0g3-g,"2,2 млн ",23_09_2022,2 недели назад
Russians Being Idiots: Fails Around The World,,https://www.youtube.com/watch?v=m8LxclIZ96I,6 млн ,23_09_2022,3 недели назад
Kid Wipes Out!,Fails Of The Week,https://www.youtube.com/watch?v=BoCrYQqryY8,"2,5 млн ",23_09_2022,3 недели назад
Epic Desert Fails,Hilarious Fails Of 2022,https://www.youtube.com/watch?v=kaQPAyEY9bg,"1,2 млн ",23_09_2022,4 недели назад
Guy Traps Himself In Toy! Fails of the Week,FailArmy,https://www.youtube.com/watch?v=d361WAsMJB4,"2,8 млн ",23_09_2022,1 месяц назад
Aussies Being Idiots: Fails Around The World 2022,,https://www.youtube.com/watch?v=6LA2YUFaVrA,"3,7 млн ",23_09_2022,1 месяц назад
Baby Spills Paint EVERYWHERE! Fails of the Week,FailArmy,https://www.youtube.com/watch?v=4vHOG5LgiWI,"2,1 млн ",23_09_2022,1 месяц назад
People Having A Bad Day,Funny Fails Compilation Pt.3,https://www.youtube.com/watch?v=ypgp9EL5OZg,"6,6 млн ",23_09_2022,1 месяц назад
Get Back in the Saddle! Fails of the Week,FailArmy,https://www.youtube.com/watch?v=UMwa5sBYofg,"2,3 млн ",23_09_2022,1 месяц назад
Americans Being Idiots: Fails Around The World 2022,,https://www.youtube.com/watch?v=X6xoS38qbAw,"4,4 млн ",23_09_2022,1 месяц назад
Quick and Dirty - Fails of the Week,FailArmy,https://www.youtube.com/watch?v=KfeHyB_BXv8,"2,5 млн ",23_09_2022,1 месяц назад
People Being Idiots: Stupidity At Its Best,FailArmy,https://www.youtube.com/watch?v=CE4VIMWUQws,19 млн ,23_09_2022,1 месяц назад
Overly Ambitious - Fails of the Week,FailArmy,https://www.youtube.com/watch?v=udvVcw7KW-8,"3,1 млн ",23_09_2022,2 месяца назад
Dumb Drivers,,https://www.youtube.com/watch?v=tKTy16mC2g4,12 млн ,23_09_2022,2 месяца назад
Totally Totaled - Fails of the Week,FailArmy,https://www.youtube.com/watch?v=U3awc7YOt9M,"2,9 млн ",23_09_2022,2 месяца назад
I Hate My Family,,https://www.youtube.com/watch?v=PgJTBNnjt94,"3,4 млн ",23_09_2022,2 месяца назад
Best Fails of the Year (So Far) 2022,,https://www.youtube.com/watch?v=lNe1D_E3R8E,24 млн ,23_09_2022,2 месяца назад
Funniest Party Fails Ever,FailArmy,https://www.youtube.com/watch?v=6sCYmygjoVc,"1,4 млн ",23_09_2022,2 месяца назад
Don't Drink and Drive! Fails of the Week,FailArmy,https://www.youtube.com/watch?v=akHey2xF5O4,"3,1 млн ",23_09_2022,2 месяца назад
Most Awkward Public Moments Caught on Camera,,https://www.youtube.com/watch?v=2AMrOM32EQY,"2,9 млн ",23_09_2022,2 месяца назад
Going Big - Fails of the Week,FailArmy,https://www.youtube.com/watch?v=raZfHXX0_Lc,"2,2 млн ",23_09_2022,2 месяца назад
Anesthesia Fails w/ Patients Talking Funny,FailArmy,https://www.youtube.com/watch?v=7Llap75GsuY,849 тыс. ,23_09_2022,3 месяца назад
Swatted! Fails of the Week,FailArmy,https://www.youtube.com/watch?v=i_WndusYcMI,"2,7 млн ",23_09_2022,3 месяца назад
Hilarious Dad Fails - Father's Day Special,FailArmy,https://www.youtube.com/watch?v=jnqKTWFC37A,"2,5 млн ",23_09_2022,3 месяца назад
Brace For Impact! Fails of the Week,FailArmy,https://www.youtube.com/watch?v=QjeuJAxuiTY,"1,8 млн ",23_09_2022,3 месяца назад
Trips and Fails - Funny Travel Accidents Compilation,FailArmy,https://www.youtube.com/watch?v=W5lYSUwellg,"2,8 млн ",23_09_2022,3 месяца назад
Summer Bummers - Fails of the Week,FailArmy,https://www.youtube.com/watch?v=YBFPos0G_e4,"1,9 млн ",23_09_2022,3 месяца назад
Very Expensive Fails Compilation,FailArmy,https://www.youtube.com/watch?v=WWxLjAqSM18,"8,4 млн ",23_09_2022,3 месяца назад
Heads Up! Fails of the Week,FailArmy,https://www.youtube.com/watch?v=GLMgiq5l-Yw,2 млн ,23_09_2022,3 месяца назад
Surprised and Unexpected Fails,FailArmy,https://www.youtube.com/watch?v=Q7wajx1BjlA,"3,8 млн ",23_09_2022,3 месяца назад
Coming In Hot! Fails of the Week,FailArmy,https://www.youtube.com/watch?v=vuFfhRTKalw,"1,9 млн ",23_09_2022,4 месяца назад
Love Hurts - Funny Wedding Fails,FailArmy,https://www.youtube.com/watch?v=Ecr0-j8BivE,"2,7 млн ",23_09_2022,4 месяца назад
Day Ruined! Fails of the Week,FailArmy,https://www.youtube.com/watch?v=2o2fzpFrk8c,"2,2 млн ",23_09_2022,4 месяца назад
Funny Girl Fails - Motherhood Bloopers,FailArmy,https://www.youtube.com/watch?v=-AxH0yFcpyY,"1,7 млн ",23_09_2022,4 месяца назад
Watch The Face! Fails of the Week,FailArmy,https://www.youtube.com/watch?v=g-TwQ2wq-d4,"3,3 млн ",23_09_2022,4 месяца назад
Ultimate Funny Beach Fails 2022,FailArmy,https://www.youtube.com/watch?v=9i_ixxuEwfQ,"2,6 млн ",23_09_2022,4 месяца назад
Big Mistakes - Fails of the Week,FailArmy,https://www.youtube.com/watch?v=2gjKoP5bwbQ,"8,9 млн ",23_09_2022,4 месяца назад
Vacation Fails - Funny Travel Blunders,FailArmy,https://www.youtube.com/watch?v=UK0mkYUWSyY,"4,4 млн ",23_09_2022,4 месяца назад
When Down is Up - Fails Of The Week,FailArmy,https://www.youtube.com/watch?v=94ma_TGPCLQ,"3,1 млн ",23_09_2022,5 месяцев назад
Mega Mother Nature Fails Collection,FailArmy,https://www.youtube.com/watch?v=kOefV_H-CRs,"9,6 млн ",23_09_2022,5 месяцев назад
In The Dumps - Fails of the Week,FailArmy,https://www.youtube.com/watch?v=NHXCmigkkRA,"1,9 млн ",23_09_2022,5 месяцев назад
Funny Fails Around The World!,FailArmy,https://www.youtube.com/watch?v=645BXYpyW-Q,"8,4 млн ",23_09_2022,5 месяцев назад
Right Place Wrong Time - Fails of the Week,FailArmy,https://www.youtube.com/watch?v=7xjxIAs8RWA,"4,7 млн ",23_09_2022,5 месяцев назад
Ultimate Parking Fails - Funny Cars and Bad Drivers Compilation,FailArmy,https://www.youtube.com/watch?v=c_u8oPMBGEI,"6,5 млн ",23_09_2022,5 месяцев назад
Hard Landing - Fails of the Week,FailArmy,https://www.youtube.com/watch?v=5I8UzzqZJyQ,"4,2 млн ",23_09_2022,5 месяцев назад
Most Embarrassing Fails - Clumsy Funny People Compilation,FailArmy,https://www.youtube.com/watch?v=u8Lsl2Ec20A,"4,6 млн ",23_09_2022,5 месяцев назад
Too Much Send - Fails of the Week,FailArmy,https://www.youtube.com/watch?v=YkXa90RoENM,3 млн ,23_09_2022,5 месяцев назад
Watch Your Step! Funny Slips and Falls Compilation,FailArmy,https://www.youtube.com/watch?v=3RlqV-MikN0,"1,5 млн ",23_09_2022,5 месяцев назад
Weary Travels - Fails of the Week,FailArmy,https://www.youtube.com/watch?v=2nvKRc94o0Y,"5,2 млн ",23_09_2022,6 месяцев назад
Man's Best Friend Fails - Hilarious Dogs and Puppies Compilation,FailArmy,https://www.youtube.com/watch?v=W4R4bZkuUvE,"1,2 млн ",23_09_2022,6 месяцев назад
Down Bad - Fails of the Week,FailArmy,https://www.youtube.com/watch?v=hAKcWzjJKwk,"2,3 млн ",23_09_2022,6 месяцев назад
Worst Race Cars Ever - Track & Rally Fails,FailArmy,https://www.youtube.com/watch?v=Cz3S3jZ_Jtg,"3,2 млн ",23_09_2022,6 месяцев назад
Under Pressure - Fails of the Week,FailArmy,https://www.youtube.com/watch?v=RYn65SxYgfQ,"3,5 млн ",23_09_2022,6 месяцев назад
It Didn't Go How They Thought It Would // Expectation vs Reality,,https://www.youtube.com/watch?v=Y9YQFMxBwQE,"7,4 млн ",23_09_2022,6 месяцев назад
Outdoors and in Trouble - Fails of the Week,FailArmy,https://www.youtube.com/watch?v=f9n1or4NgBQ,"1,9 млн ",23_09_2022,6 месяцев назад
Try Not To Laugh,Hilarious Fails Caught on Camera,https://www.youtube.com/watch?v=iglu_K_vbAY,"6,6 млн ",23_09_2022,6 месяцев назад
Don't Do This While Painting! Fails of the Week,FailArmy,https://www.youtube.com/watch?v=NiWFLxJOrTA,"1,6 млн ",23_09_2022,7 месяцев назад
Sloppy Snow Sports,Winter Athletics Fails Compilation,https://www.youtube.com/watch?v=lMv2QvPF5Ws,897 тыс. ,23_09_2022,7 месяцев назад
Barn Gets Destroyed! Fails Of The Week,FailArmy,https://www.youtube.com/watch?v=QZodOg76f48,"2,2 млн ",23_09_2022,7 месяцев назад
Fails With Benefits,Valentine's Day Couples Fails,https://www.youtube.com/watch?v=V150SXtUWAw,"2,4 млн ",23_09_2022,7 месяцев назад
Bear Attacks Man - Best Fails Of The Week,,https://www.youtube.com/watch?v=lHYQTJE8UPo,"2,3 млн ",23_09_2022,7 месяцев назад
People Having A Bad Day,Funny Fails Compilation Pt.2,https://www.youtube.com/watch?v=GoCASqOnyJ4,11 млн ,23_09_2022,7 месяцев назад
Down and Out! Fails of the Week,FailArmy,https://www.youtube.com/watch?v=VUXJCKwB9Ag,"3,7 млн ",23_09_2022,7 месяцев назад
"Work Hard, Fail Harder",Funny Job and Workplace Mistakes,https://www.youtube.com/watch?v=g9eS3ND9TsQ,"9,3 млн ",23_09_2022,7 месяцев назад
Riding Dirty - Fails of the Week,FailArmy,https://www.youtube.com/watch?v=ilaM2JX0ep0,"5,5 млн ",23_09_2022,8 месяцев назад
Crazy Dashcam Fails - Bad Drivers and Road Mayhem Compilation,FailArmy,https://www.youtube.com/watch?v=WUoIgQI2wPA,15 млн ,23_09_2022,8 месяцев назад
Face The Pain - Fails of the Week,FailArmy,https://www.youtube.com/watch?v=NMPvSJMbtqY,"4,2 млн ",23_09_2022,8 месяцев назад
Winter's Worst Wipeouts,FailArmy,https://www.youtube.com/watch?v=cNBFFR5IFHY,2 млн ,23_09_2022,8 месяцев назад
2022 Is Gonna HURT! - Fails of the Week,FailArmy,https://www.youtube.com/watch?v=ME8hn4gdHIc,"5,7 млн ",23_09_2022,8 месяцев назад
"New Year, Same Bod",Funny Fitness Fails Compilation,https://www.youtube.com/watch?v=rg9FzNti3A4,"3,3 млн ",23_09_2022,8 месяцев назад
Hard Stop - Last Fails of the Week 2021,FailArmy,https://www.youtube.com/watch?v=qEVSG2fgMMI,"4,5 млн ",23_09_2022,8 месяцев назад
Damn Nature You Scary Pt. 2,Funny Scary Animal Encounters,https://www.youtube.com/watch?v=0nUeIjPrsCM,27 млн ,23_09_2022,8 месяцев назад
Christmas Fails of the Week,FailArmy,https://www.youtube.com/watch?v=BjdEP-0dETg,"4,7 млн ",23_09_2022,8 месяцев назад
The Best Pranks of 2021,FailArmy,https://www.youtube.com/watch?v=FbN7aKYrtgk,5 млн ,23_09_2022,9 месяцев назад
Mission Failed - Fails of the Week,FailArmy,https://www.youtube.com/watch?v=lSvwZN25tfc,"3,8 млн ",23_09_2022,9 месяцев назад
Most EPIC EXPENSIVE Fails,Wrecks and Damage Compilation 2021,https://www.youtube.com/watch?v=HmdyupSfrfc,14 млн ,23_09_2022,9 месяцев назад
Best Fails Of The Year 2021,FailArmy,https://www.youtube.com/watch?v=BNiTVsAlzlc,69 млн ,23_09_2022,9 месяцев назад
Ultimate Security Camera Fails,Best of CCTV 2021 Compilation,https://www.youtube.com/watch?v=_2tSBxyAwLs,20 млн ,23_09_2022,9 месяцев назад
Life of the Party,Group Fails Compilation,https://www.youtube.com/watch?v=VFV4V-lOQ3w,"4,5 млн ",23_09_2022,9 месяцев назад
World Gone Wild - Fails of the Week,FailArmy,https://www.youtube.com/watch?v=ZvcOQKI5EGM,4 млн ,23_09_2022,10 месяцев назад
Idiots On Bikes,Hilarious Cyclist Fails Compilation,https://www.youtube.com/watch?v=YS15RLUQ_FU,55 млн ,23_09_2022,10 месяцев назад
Perfect 10,Feats of Failed Athleticism,https://www.youtube.com/watch?v=NEJVomliQHc,3 млн ,23_09_2022,10 месяцев назад
Collision Courses - Fails of the Week,FailArmy,https://www.youtube.com/watch?v=FDZCRlrBik4,12 млн ,23_09_2022,10 месяцев назад
Idiots In Cars,Ridiculous Driver Fails of 2021,https://www.youtube.com/watch?v=iAsbV1oAkDc,26 млн ,23_09_2022,10 месяцев назад
Brace Yourself! Fails of the Week,FailArmy,https://www.youtube.com/watch?v=7rrpLV-jBw0,"3,4 млн ",23_09_2022,10 месяцев назад
FORE! Best Fails of Golfing Gone Wrong,,https://www.youtube.com/watch?v=JDmpR3B0L-U,"1,3 млн ",23_09_2022,10 месяцев назад
Surprise Headaches! Fails of the Week,FailArmy,https://www.youtube.com/watch?v=vMsgjIiOnhU,"3,1 млн ",23_09_2022,11 месяцев назад
People Vs Nature Fails,Crazy Weather Caught on Camera,https://www.youtube.com/watch?v=IFxZoAp0T-0,23 млн ,23_09_2022,11 месяцев назад
Don't Flinch! Fails of the Week,FailArmy,https://www.youtube.com/watch?v=YBfN2MKs_Uo,"4,1 млн ",23_09_2022,11 месяцев назад
FAILS AROUND THE GLOBE,Worldwide Compilation of Failure,https://www.youtube.com/watch?v=Ikq__lBIQ5s,"8,6 млн ",23_09_2022,11 месяцев назад
Collateral Damage - Fails of the Week,FailArmy,https://www.youtube.com/watch?v=zyuBLDt_dC8,3 млн ,23_09_2022,11 месяцев назад
EXPECTATION vs REALITY,Cool Stunts & Fails Compilation,https://www.youtube.com/watch?v=nzloNZNIhQ4,21 млн ,23_09_2022,11 месяцев назад
Don’t Freak Out! Fails of the Week,FailArmy,https://www.youtube.com/watch?v=nj8lVT3QwaY,"3,3 млн ",23_09_2022,11 месяцев назад
Tricks That Failed Miserably,Stunt Fails 2021,https://www.youtube.com/watch?v=AzfbwiXsrY4,"1,3 млн ",23_09_2022,11 месяцев назад
Cruel and Unusual - Fails of the Week,FailArmy,https://www.youtube.com/watch?v=3jPSQvrPb-0,10 млн ,23_09_2022,11 месяцев назад
FIRST DAY OF FALL,Autumn Fails Compilation,https://www.youtube.com/watch?v=RR0b6K5Uk_k,4 млн ,23_09_2022,1 год назад
Best Worst Days Ever - Fails of the Week,FailArmy,https://www.youtube.com/watch?v=vzAVqF_KVLE,8 млн ,23_09_2022,1 год назад
Fails On A Plane,Wild Travel and Flying Fails Compilation,https://www.youtube.com/watch?v=tN5q2AQTTJ8,"8,4 млн ",23_09_2022,1 год назад
Timeout!,Hilarious Sports Fails 2021,https://www.youtube.com/watch?v=hxHSKTy4k_A,"2,8 млн ",23_09_2022,1 год назад
Watch Where You're Failing! Fails of the Week - FailArmy,,https://www.youtube.com/watch?v=pZG_0nX5nEY,"4,8 млн ",23_09_2022,1 год назад
Damn Nature You Scary,Funny Scary Animal Encounters,https://www.youtube.com/watch?v=XnitQYkYYcw,162 млн ,23_09_2022,1 год назад
Old People Being Clumsy For 8 Minutes Straight 😂,,https://www.youtube.com/watch?v=XbJ8J95iXb0,"1,4 млн ",23_09_2022,1 год назад
You’re Doing It Wrong! Fails of the Week,FailArmy,https://www.youtube.com/watch?v=swb6UVPvW4A,12 млн ,23_09_2022,1 год назад
Kids Say The Funniest Things,Funny Moments Compilation,https://www.youtube.com/watch?v=j8rl11LLRbs,"1,4 млн ",23_09_2022,1 год назад
You Wouldn't Believe It!,Unbelievable Fails Compilation,https://www.youtube.com/watch?v=uP-T7CtSiPU,16 млн ,23_09_2022,1 год назад
How to Make Your Friends Mad - Fails of the Week,FailArmy,https://www.youtube.com/watch?v=AzqERDI-Ri8,"5,6 млн ",23_09_2022,1 год назад
OLD DOG NEW FAILS,Dogs Failing Compilation,https://www.youtube.com/watch?v=Qv58hR2SGkg,"3,8 млн ",23_09_2022,1 год назад
People Having A Bad Day,Funny Fails Compilation,https://www.youtube.com/watch?v=J7xddqV73bM,15 млн ,23_09_2022,1 год назад
Surprise Wreckage - Fails of the Week,FailArmy,https://www.youtube.com/watch?v=gdqOcVC4UfE,"6,9 млн ",23_09_2022,1 год назад
Don’t Mess With My Car!,Funny Vehicle Fails,https://www.youtube.com/watch?v=u1y2eBpo9aM,"2,1 млн ",23_09_2022,1 год назад
I QUIT! Funniest Workplace Fails,,https://www.youtube.com/watch?v=mPWJGXXBxpg,"7,6 млн ",23_09_2022,1 год назад
It’s Not How It Looks! Fails of the Week,FailArmy,https://www.youtube.com/watch?v=BqZIldZCneE,12 млн ,23_09_2022,1 год назад
Most SAVAGE Siblings,Funniest Sibling Pranks & Fails 🤣,https://www.youtube.com/watch?v=f5lu-fwM9tI,"1,8 млн ",23_09_2022,1 год назад
Expensive Boat Fails Caught On Camera,FailArmy,https://www.youtube.com/watch?v=YqseTGOnzYg,15 млн ,23_09_2022,1 год назад
Why You NEED a Helmet - Fails of the Week,FailArmy,https://www.youtube.com/watch?v=xWTWjHq2YM8,"2,4 млн ",23_09_2022,1 год назад
Funny Cat Fails,Funny Cat Compilation - FailArmy,https://www.youtube.com/watch?v=DHfRfU3XUEo,2 млн ,23_09_2022,1 год назад
Monkey Steals From Security Guard - Fails of the Week,,https://www.youtube.com/watch?v=7QXobTRMDew,"1,6 млн ",23_09_2022,1 год назад
BFF: Best Friend Fails Compilation 2021,,https://www.youtube.com/watch?v=cJUBsB-Mxn4,"3,3 млн ",23_09_2022,1 год назад
Why You Shouldn't Show Off - Fails of the Week,FailArmy,https://www.youtube.com/watch?v=l9Q4lQVSvAg,"5,2 млн ",23_09_2022,1 год назад
BEST KNOCKDOWNS & WIPEOUTS,FailArmy,https://www.youtube.com/watch?v=RDNyWsX5yOk,"4,2 млн ",23_09_2022,1 год назад
FOOLS IN POOLS (Funny Pool Fails),FailArmy,https://www.youtube.com/watch?v=V_cRKk7y4OA,"7,7 млн ",23_09_2022,1 год назад
Instant Regret Compilation (Big Mistake),FailArmy,https://www.youtube.com/watch?v=iHhlXAmzSBc,"6,9 млн ",23_09_2022,1 год назад
BEST FAILS OF THE YEAR (So Far) 2021,FailArmy,https://www.youtube.com/watch?v=jNMb2YMmZI0,29 млн ,23_09_2022,1 год назад
Messy Food Fails,How Not To Cook 2021,https://www.youtube.com/watch?v=srEOVbJaUnw,"1,2 млн ",23_09_2022,1 год назад
Relentless Accidents - Fails of the Week,FailArmy,https://www.youtube.com/watch?v=POJp6Pbd-8I,"3,1 млн ",23_09_2022,1 год назад
Funny Reaction Fails,Try Not To Laugh 2021,https://www.youtube.com/watch?v=1niSWGlGyvo,"2,3 млн ",23_09_2022,1 год назад
The Taste of Fail - Fails Of The Week,FailArmy,https://www.youtube.com/watch?v=x4dOHZzbPvA,"6,1 млн ",23_09_2022,1 год назад
Held onto that umbrella with an iron grip. 💪,,https://www.youtube.com/shorts/xTJSoc6AwOI,309 тыс. ,23_09_2022,1 год назад
Beautiful day for a swim! 😂 #FailArmy,,https://www.youtube.com/shorts/LG8zGSaHmFo,307 тыс. ,23_09_2022,1 год назад
At least the trailer is clean 🤣 #FailArmy,,https://www.youtube.com/shorts/1-_xUafkxt8,293 тыс. ,23_09_2022,1 год назад
About 10 degrees from an ACL tear.,,https://www.youtube.com/shorts/h_oP9SG-_aY,251 тыс. ,23_09_2022,1 год назад
This happens when you overdress but underpower.,,https://www.youtube.com/shorts/6VQcz6zokEs,230 тыс. ,23_09_2022,1 год назад
This man needs a turtle shell!,,https://www.youtube.com/shorts/VCjyxHgZC4c,261 тыс. ,23_09_2022,1 год назад
Selfie Fail Compilation 📷,,https://www.youtube.com/watch?v=dXhleLEM3eE,"1,2 млн ",23_09_2022,1 год назад
Angry Farmer Flips Car Off His Land - Fails Of The Week,FailArmy,https://www.youtube.com/watch?v=T4R_wEp4FHo,"3,1 млн ",23_09_2022,1 год назад
FATHERS FAILING FOR EIGHT MINUTES STRAIGHT,,https://www.youtube.com/watch?v=eOeWxndrtiA,"1,6 млн ",23_09_2022,1 год назад
Failing Fast and Hard - Fails of the Week,FailArmy,https://www.youtube.com/watch?v=XDxeczB5IrY,"3,1 млн ",23_09_2022,1 год назад
Epic Bicycle Bloopers,Fails Compilation,https://www.youtube.com/watch?v=0xyS2LrhXF8,"3,2 млн ",23_09_2022,1 год назад
Nature Strikes Back - Fails of the Week,FailArmy,https://www.youtube.com/watch?v=ZYlolF_vYxg,"1,7 млн ",23_09_2022,1 год назад
Summertime Madness,Fails Compilation,https://www.youtube.com/watch?v=nwG2HyDr-W8,"1,1 млн ",23_09_2022,1 год назад
Why Do This To Yourself? Fails of the Week,FailArmy,https://www.youtube.com/watch?v=wkNnXpcvceY,10 млн ,23_09_2022,1 год назад
GAME OVER,FUNNY VIRTUAL REALITY FAILS,https://www.youtube.com/watch?v=o6wO0pL0tQs,632 тыс. ,23_09_2022,1 год назад
People Getting Wrecked - Fails of the Week,FailArmy,https://www.youtube.com/watch?v=9V8YC1aNU8o,11 млн ,23_09_2022,1 год назад
Crazy Ride Reactions -  Scream Machine,,https://www.youtube.com/watch?v=pA-lVdX2WJk,"3,1 млн ",23_09_2022,1 год назад
Scare Fails! Fails of the Week,FailArmy,https://www.youtube.com/watch?v=AcVW0AvkgGc,"1,4 млн ",23_09_2022,1 год назад
She Didn't EXPECT THAT!,,https://www.youtube.com/watch?v=HRBjQfk0-c8,"2,4 млн ",23_09_2022,1 год назад
Ripping Up the Highway - Fails of the Week,FailArmy,https://www.youtube.com/watch?v=Cs_hfsu1wd0,1 млн ,23_09_2022,1 год назад
57 Workout Fails You DON'T Want To Repeat! FailArmy,,https://www.youtube.com/watch?v=QZLWn5UsdjA,"8,1 млн ",23_09_2022,1 год назад
Faceplants for the Earth - Fails of the Week,FailArmy,https://www.youtube.com/watch?v=SLdC3i8WGhY,"2,4 млн ",23_09_2022,1 год назад
Why You Shouldn't Walk On A Frozen Lake,Human vs Earth Fails,https://www.youtube.com/watch?v=e6ES1X-ZHyw,1 млн ,23_09_2022,1 год назад
Elephant Enjoys a Relaxing Afternoon #shorts,,https://www.youtube.com/shorts/16HVKAwjRNQ,238 тыс. ,23_09_2022,1 год назад
Don’t Put Your Finger There! Fails of the Week,FailArmy,https://www.youtube.com/watch?v=Om8HI2OJlMo,"2,6 млн ",23_09_2022,1 год назад
Who's Gonna Pay?,Funny Expensive Fails Compilation 2021,https://www.youtube.com/watch?v=E9gfi1snEms,"2,6 млн ",23_09_2022,1 год назад
Bad Hair Day! Fails of the Week,FailArmy,https://www.youtube.com/watch?v=VtwBGl30L_c,"1,6 млн ",23_09_2022,1 год назад
People Vs Animals: Funny Animal Fails Compilation,,https://www.youtube.com/watch?v=jUCv_oi0kDo,"5,2 млн ",23_09_2022,1 год назад
Monkey Attacks Woman! Fails of the Week,FailArmy,https://www.youtube.com/watch?v=rdS6nod-p_I,"1,8 млн ",23_09_2022,1 год назад
Never-Ending Shampoo: Best Pranks Compilation 2021,,https://www.youtube.com/watch?v=BVL3hBbqW_I,839 тыс. ,23_09_2022,1 год назад
Mommy's A WHAT?! Fails Of The Week,FailArmy,https://www.youtube.com/watch?v=CSM4ALwp94Y,"1,5 млн ",23_09_2022,1 год назад
Funny Spring Break Fails 2021,FailArmy,https://www.youtube.com/watch?v=-rHRiqJ0SzI,"1,7 млн ",23_09_2022,1 год назад
Funniest Rides,Fails of the Week,https://www.youtube.com/watch?v=fwQ8FW7cHq4,"2,1 млн ",23_09_2022,1 год назад
When The Ice Breaks... Fails of The Week,FailArmy 2021,https://www.youtube.com/watch?v=wPo3_tzFT2U,"4,4 млн ",23_09_2022,1 год назад
Best Women Pranks of 2021 So Far,,https://www.youtube.com/watch?v=64R-K7h7Ppc,"1,3 млн ",23_09_2022,1 год назад
Waves of Failure,,https://www.youtube.com/watch?v=qk8ss6ux1B4,"2,5 млн ",23_09_2022,1 год назад
CAUGHT ON CAM,Security Cameras Compilation 2021,https://www.youtube.com/watch?v=bD5-sHcjyts,14 млн ,23_09_2022,1 год назад
Worst Place To Park: Fails of the Week 2021,FailArmy,https://www.youtube.com/watch?v=Gmvb7_xkA24,5 млн ,23_09_2022,1 год назад
Unexpected And Embarrassing Fart Moments: Funny Videos,FailArmy,https://www.youtube.com/watch?v=EzVMV2ZJzsM,"7,3 млн ",23_09_2022,1 год назад
Sticky Situations: Fails of the Week (February 2021),FailArmy,https://www.youtube.com/watch?v=WL8qH3BCScI,"2,9 млн ",23_09_2022,1 год назад
Best Wedding Fails,Funniest Wedding Fails Compilation 2021,https://www.youtube.com/watch?v=trgX6B7DvL4,"6,9 млн ",23_09_2022,1 год назад
Winter Meltdown,Fails Of The Week (February 2021),https://www.youtube.com/watch?v=PSczpmmwVDI,"1,3 млн ",23_09_2022,1 год назад
WINTER is the Fail Time Of The Year! - Funny Snow Fails,FailArmy,https://www.youtube.com/watch?v=s1O8BJD3QH4,"6,4 млн ",23_09_2022,1 год назад
Back To Nature,Fails of the Week (February 2021),https://www.youtube.com/watch?v=_UtXt-b0sfk,3 млн ,23_09_2022,1 год назад
Funny Family Fails,FailArmy 2021,https://www.youtube.com/watch?v=707CHMEDl4s,"1,6 млн ",23_09_2022,1 год назад
Fall So Good: Fails of the Week (January 2021),FailArmy,https://www.youtube.com/watch?v=_dZx-gIjAVc,"3,7 млн ",23_09_2022,1 год назад
What Were They Thinking?  Self-Inflicted Fails,FailArmy,https://www.youtube.com/watch?v=Kp2jYMbRxPM,"1,6 млн ",23_09_2022,1 год назад
Flour Power: Fails of the Week (January 2021),FailArmy,https://www.youtube.com/watch?v=cyUQq8_W99o,"1,4 млн ",23_09_2022,1 год назад
People Having A Worse Day Than You: Funny Fails,FailArmy,https://www.youtube.com/watch?v=AMzyJ8XJTbk,"1,2 млн ",23_09_2022,1 год назад
Bubble Trouble: Fails of the Week (January 2021),FailArmy,https://www.youtube.com/watch?v=tlNyk9yoDEQ,"1,3 млн ",23_09_2022,1 год назад
